{
  "type": "SOURCE_REVIEW_DECISIONS",
  "schemaVersion": 1,
  "policy": "Every generated name-review group needs an explicit keep, cover, defer, retain, rewrite, or review decision before it can guide trimming. This manifest records decisions only; source deletion still requires cleanup-ledger approval.",
  "entries": [
    {
      "type": "SOURCE_REVIEW_DECISION",
      "target": {
        "type": "SOURCE_REVIEW_TARGET",
        "primitiveType": "AGENT",
        "name": "analyzer"
      },
      "decision": "RETAIN_EXTERNAL",
      "status": "DECIDED",
      "queueEvidence": {
        "type": "QUEUE_EVIDENCE",
        "queueType": "NAME_REVIEW",
        "generatedAction": "DEDUP_IDENTICAL_NAME",
        "priority": 2,
        "entryCount": 5,
        "buckets": [
          "authored-local",
          "installed-marketplace",
          "runtime"
        ],
        "sourceRoots": [
          "claude-plugins",
          "global-agent-skills",
          "kast-agent-skills"
        ],
        "sourceDigests": [
          "sha256:bf68f4cac5a56c673a928c2e6d619586c5b93ea364026ab37547772cb45a663a"
        ]
      },
      "rationale": "This group is runtime, system, or installed first-party material. Keep it external for now and reference the local canonical alternative when one exists.",
      "nextAction": "Do not import this source into intelligence. Keep it available through its owning runtime or first-party distribution.",
      "canonicalCoverage": [
        {
          "type": "CANONICAL_COVERAGE",
          "path": "skills/skill-primitive-authoring",
          "notes": "Use this local primitive instead of promoting the reviewed source under its current name."
        }
      ]
    },
    {
      "type": "SOURCE_REVIEW_DECISION",
      "target": {
        "type": "SOURCE_REVIEW_TARGET",
        "primitiveType": "AGENT",
        "name": "comparator"
      },
      "decision": "RETAIN_EXTERNAL",
      "status": "DECIDED",
      "queueEvidence": {
        "type": "QUEUE_EVIDENCE",
        "queueType": "NAME_REVIEW",
        "generatedAction": "DEDUP_IDENTICAL_NAME",
        "priority": 2,
        "entryCount": 5,
        "buckets": [
          "authored-local",
          "installed-marketplace",
          "runtime"
        ],
        "sourceRoots": [
          "claude-plugins",
          "global-agent-skills",
          "kast-agent-skills"
        ],
        "sourceDigests": [
          "sha256:fe1fc9787c495d864c5d6eada47396478572325fde1b33a96d78bf4b849b7a3e"
        ]
      },
      "rationale": "This group is runtime, system, or installed first-party material. Keep it external for now and reference the local canonical alternative when one exists.",
      "nextAction": "Do not import this source into intelligence. Keep it available through its owning runtime or first-party distribution.",
      "canonicalCoverage": [
        {
          "type": "CANONICAL_COVERAGE",
          "path": "skills/skill-primitive-authoring",
          "notes": "Use this local primitive instead of promoting the reviewed source under its current name."
        }
      ]
    },
    {
      "type": "SOURCE_REVIEW_DECISION",
      "target": {
        "type": "SOURCE_REVIEW_TARGET",
        "primitiveType": "AGENT",
        "name": "grader"
      },
      "decision": "RETAIN_EXTERNAL",
      "status": "DECIDED",
      "queueEvidence": {
        "type": "QUEUE_EVIDENCE",
        "queueType": "NAME_REVIEW",
        "generatedAction": "DEDUP_IDENTICAL_NAME",
        "priority": 2,
        "entryCount": 5,
        "buckets": [
          "authored-local",
          "installed-marketplace",
          "runtime"
        ],
        "sourceRoots": [
          "claude-plugins",
          "global-agent-skills",
          "kast-agent-skills"
        ],
        "sourceDigests": [
          "sha256:57134da0c1a4eea33fbd74a1c9c44aa814f07d6bc64de303edb586f941e5d21a"
        ]
      },
      "rationale": "This group is runtime, system, or installed first-party material. Keep it external for now and reference the local canonical alternative when one exists.",
      "nextAction": "Do not import this source into intelligence. Keep it available through its owning runtime or first-party distribution.",
      "canonicalCoverage": [
        {
          "type": "CANONICAL_COVERAGE",
          "path": "skills/skill-primitive-authoring",
          "notes": "Use this local primitive instead of promoting the reviewed source under its current name."
        }
      ]
    },
    {
      "type": "SOURCE_REVIEW_DECISION",
      "target": {
        "type": "SOURCE_REVIEW_TARGET",
        "primitiveType": "AGENT",
        "name": "kotlin-boundary-contract-reviewer"
      },
      "decision": "COVERED_BY_CANONICAL",
      "status": "DECIDED",
      "queueEvidence": {
        "type": "QUEUE_EVIDENCE",
        "queueType": "NAME_REVIEW",
        "generatedAction": "DEDUP_IDENTICAL_NAME",
        "priority": 2,
        "entryCount": 2,
        "buckets": [
          "authored-local",
          "canonical"
        ],
        "sourceRoots": [
          "examplar-agents",
          "intelligence"
        ],
        "sourceDigests": [
          "sha256:fa2a10dff2f0308259127ad3abb1ad64bc9eb3d9af3a257b9f9cf3738e9ea472"
        ]
      },
      "rationale": "A local canonical primitive already covers this review group under a non-colliding name. Keep source candidates as provenance until runtime activation and cleanup ledger entries are reviewed.",
      "nextAction": "Use the canonical coverage path for new plugin composition; create cleanup-ledger entries only after runtime-link activation is approved.",
      "canonicalCoverage": [
        {
          "type": "CANONICAL_COVERAGE",
          "path": "agents/kotlin-review/kotlin-boundary-contract-reviewer.agent.md",
          "notes": "Use this local primitive instead of promoting the reviewed source under its current name."
        }
      ]
    },
    {
      "type": "SOURCE_REVIEW_DECISION",
      "target": {
        "type": "SOURCE_REVIEW_TARGET",
        "primitiveType": "AGENT",
        "name": "kotlin-package-cohesion-reviewer"
      },
      "decision": "COVERED_BY_CANONICAL",
      "status": "DECIDED",
      "queueEvidence": {
        "type": "QUEUE_EVIDENCE",
        "queueType": "NAME_REVIEW",
        "generatedAction": "DEDUP_IDENTICAL_NAME",
        "priority": 2,
        "entryCount": 2,
        "buckets": [
          "authored-local",
          "canonical"
        ],
        "sourceRoots": [
          "examplar-agents",
          "intelligence"
        ],
        "sourceDigests": [
          "sha256:0ade97ff63036325e2bf05fb48a6b453bb6ea93e9dc1d244f36ba951ace56fb5"
        ]
      },
      "rationale": "A local canonical primitive already covers this review group under a non-colliding name. Keep source candidates as provenance until runtime activation and cleanup ledger entries are reviewed.",
      "nextAction": "Use the canonical coverage path for new plugin composition; create cleanup-ledger entries only after runtime-link activation is approved.",
      "canonicalCoverage": [
        {
          "type": "CANONICAL_COVERAGE",
          "path": "agents/kotlin-review/kotlin-package-cohesion-reviewer.agent.md",
          "notes": "Use this local primitive instead of promoting the reviewed source under its current name."
        }
      ]
    },
    {
      "type": "SOURCE_REVIEW_DECISION",
      "target": {
        "type": "SOURCE_REVIEW_TARGET",
        "primitiveType": "AGENT",
        "name": "kotlin-review-captain"
      },
      "decision": "COVERED_BY_CANONICAL",
      "status": "DECIDED",
      "queueEvidence": {
        "type": "QUEUE_EVIDENCE",
        "queueType": "NAME_REVIEW",
        "generatedAction": "DEDUP_IDENTICAL_NAME",
        "priority": 2,
        "entryCount": 2,
        "buckets": [
          "authored-local",
          "canonical"
        ],
        "sourceRoots": [
          "examplar-agents",
          "intelligence"
        ],
        "sourceDigests": [
          "sha256:b64b31256c67463b0b3f358fdc9036123ba5d331a2d4cbd21c921ab07bb5ea5b"
        ]
      },
      "rationale": "A local canonical primitive already covers this review group under a non-colliding name. Keep source candidates as provenance until runtime activation and cleanup ledger entries are reviewed.",
      "nextAction": "Use the canonical coverage path for new plugin composition; create cleanup-ledger entries only after runtime-link activation is approved.",
      "canonicalCoverage": [
        {
          "type": "CANONICAL_COVERAGE",
          "path": "agents/kotlin-review/kotlin-review-captain.agent.md",
          "notes": "Use this local primitive instead of promoting the reviewed source under its current name."
        }
      ]
    },
    {
      "type": "SOURCE_REVIEW_DECISION",
      "target": {
        "type": "SOURCE_REVIEW_TARGET",
        "primitiveType": "AGENT",
        "name": "kotlin-type-safety-reviewer"
      },
      "decision": "COVERED_BY_CANONICAL",
      "status": "DECIDED",
      "queueEvidence": {
        "type": "QUEUE_EVIDENCE",
        "queueType": "NAME_REVIEW",
        "generatedAction": "DEDUP_IDENTICAL_NAME",
        "priority": 2,
        "entryCount": 2,
        "buckets": [
          "authored-local",
          "canonical"
        ],
        "sourceRoots": [
          "examplar-agents",
          "intelligence"
        ],
        "sourceDigests": [
          "sha256:bdc2e2fcfd83bd49766e2714f4a42afe10746e3f66a2ab2c20c7ac508e27785c"
        ]
      },
      "rationale": "A local canonical primitive already covers this review group under a non-colliding name. Keep source candidates as provenance until runtime activation and cleanup ledger entries are reviewed.",
      "nextAction": "Use the canonical coverage path for new plugin composition; create cleanup-ledger entries only after runtime-link activation is approved.",
      "canonicalCoverage": [
        {
          "type": "CANONICAL_COVERAGE",